{
  "$schema": "https://local.stockmodel/workbook_module_manifest.schema.json",
  "version": "1.0.0",
  "module_contract_version": "1.1.0",
  "description": "Ticker-neutral module, profile, union-shell, and legacy-function ownership contract for the generic new-ticker engine.",
  "union_shell_profile_id": "full_union",
  "union_sheet_order": [
    "SUMMARY",
    "Valuation",
    "BS_Segments",
    "Operating_Drivers",
    "{ticker}_Investment_Case",
    "Quarter_Notes_UI",
    "Promise_Progress_UI",
    "QA_Log",
    "Needs_Review",
    "QA_Checks",
    "REPORT_IS_Q",
    "REPORT_BS_Q",
    "REPORT_CF_Q",
    "Quarter_Notes",
    "Quarter_Notes_Evidence",
    "Quarter_Narrative_Data",
    "Valuation_Summary",
    "Promise_Evidence",
    "Promise_Progress",
    "Guidance_Normalized",
    "History_Q",
    "operating_drivers_raw",
    "DATA_Period_Index",
    "Hidden_Value_Flags",
    "Hidden_Value_Audit",
    "Hidden_Value_Recompute",
    "Hidden_Value_Base",
    "Revolver_History",
    "Debt_Tranches_Latest",
    "Debt_Profile",
    "Debt_Credit_Notes",
    "Leverage_Liquidity",
    "NonGAAP_Credibility",
    "Adjusted_Metrics",
    "NonGAAP_Bridge",
    "{ticker}_Investment_Case_Data",
    "Scenario_Bridge_Tax_Treatment",
    "Scenario_Driver_Assumptions",
    "Debt_Maturity_Ladder",
    "Debt_Buckets",
    "Debt_Recon",
    "Debt_Tranches_Q",
    "Valuation_Grid",
    "Promise_Tracker",
    "Adjustments_Breakdown",
    "OCR_Text_Log"
  ],
  "dimension_contract_ids": ["total_company", "business_segment", "geography", "brand_family", "service_line", "product", "commodity_exposure"],
  "modules": [
    {
      "module_id": "core_financial_history",
      "display_name": "Core financial history and reports",
      "module_type": "core",
      "dependencies": [],
      "sheets": [
        {"sheet": "SUMMARY", "role": "visible_product", "legacy_class": "A", "default_state": "visible", "active_state": "visible", "inactive_state": "hidden", "capacity_rows": 60, "capacity_columns": 12, "headers": [], "empty_state": "Keep the universal summary frame visible and leave unsupported outputs blank.", "style_owner": "frozen_shell", "formula_owner": "standard_template_formula_contract"},
        {"sheet": "Valuation", "role": "visible_product", "legacy_class": "A", "default_state": "visible", "active_state": "visible", "inactive_state": "hidden", "capacity_rows": 271, "capacity_columns": 35, "headers": [], "empty_state": "Keep source-backed history visible; unsupported valuation outputs stay blank.", "style_owner": "frozen_shell", "formula_owner": "standard_template_formula_contract"},
        {"sheet": "REPORT_IS_Q", "role": "hidden_support", "legacy_class": "B", "default_state": "hidden", "active_state": "hidden", "inactive_state": "hidden", "capacity_rows": 5000, "capacity_columns": 7, "headers": ["period", "metric", "value", "unit", "source_ref", "status", "definition"], "empty_state": "Header-only hidden projection until normalized income-statement history is available.", "style_owner": "frozen_shell", "formula_owner": "none"},
        {"sheet": "History_Q", "role": "hidden_support", "legacy_class": "B", "default_state": "hidden", "active_state": "hidden", "inactive_state": "hidden", "capacity_rows": 1000, "capacity_columns": 7, "headers": ["period", "period_ordinal", "metric", "value", "unit", "source_ref", "status"], "empty_state": "Header-only hidden calculation axis until exact planned history rows are written.", "style_owner": "frozen_shell", "formula_owner": "standard_template_formula_contract"},
        {"sheet": "DATA_Period_Index", "role": "hidden_support", "legacy_class": "B", "default_state": "hidden", "active_state": "hidden", "inactive_state": "hidden", "capacity_rows": 5000, "capacity_columns": 6, "headers": ["period", "period_ordinal", "period_type", "fiscal_year", "fiscal_quarter", "status"], "empty_state": "Header-only period index; full raw period detail remains external.", "style_owner": "frozen_shell", "formula_owner": "none"}
      ],
      "visible_blocks": [
        {"block_id": "summary_shell_header", "sheet": "SUMMARY", "target": "A1:L2", "empty_state": "The neutral summary title remains visible."},
        {"block_id": "summary_financials", "sheet": "SUMMARY", "target": "A26:L40", "empty_state": "Unsupported financial outputs stay blank."},
        {"block_id": "valuation_income_history", "sheet": "Valuation", "target": "A1:M22", "empty_state": "Period headers and source-backed income history populate only from validated bindings."},
        {"block_id": "valuation_operating_history", "sheet": "Valuation", "target": "A30:M40", "empty_state": "Unsupported operating and net-income outputs stay blank."},
        {"block_id": "valuation_share_history", "sheet": "Valuation", "target": "A100:M109", "empty_state": "Share and GAAP EPS rows remain blank without validated facts."},
        {"block_id": "valuation_gross_profit_helper", "sheet": "Valuation", "target": "A262:M262", "empty_state": "Hidden formula input remains blank without validated gross profit."}
      ],
      "normalized_contracts": ["ticker_metadata", "company_profile", "quarterly_financials", "annual_financials", "calculation_history"],
      "binding_ids": ["summary_as_of_quarter", "summary_latest_net_income", "summary_latest_revenue", "valuation_period_headers", "valuation_revenue_series", "valuation_gross_profit_series", "valuation_ebitda_series", "valuation_operating_income_series", "valuation_net_income_series", "valuation_diluted_shares_series", "valuation_shares_outstanding_series", "valuation_eps_series", "calculation_history_quarterly_rows"],
      "formula_ids": ["revenue_ttm", "revenue_yoy", "gross_margin", "operating_margin", "operating_margin_ttm", "ebitda_margin", "ebitda_yoy", "ebitda_ttm", "ebitda_margin_ttm", "operating_income_margin", "operating_income_ttm", "operating_income_margin_ttm", "net_margin", "net_income_yoy", "net_income_ttm", "net_margin_ttm", "diluted_shares_qoq", "diluted_shares_yoy", "gaap_eps_yoy", "gaap_eps_ttm"],
      "defined_name_ids": ["CompanyOperatingMargin_Latest", "OperatingMargin_Latest", "CompanyOperatingMargin_TTM", "summary_key_financials_anchor", "valuation_actuals_anchor", "valuation_share_count_anchor"],
      "style_ownership": [
        {"style_id": "summary_shell_header_style", "sheet": "SUMMARY", "target": "A1:L2"},
        {"style_id": "summary_financials_style", "sheet": "SUMMARY", "target": "A26:L40"},
        {"style_id": "valuation_income_history_style", "sheet": "Valuation", "target": "A1:M22"},
        {"style_id": "valuation_operating_history_style", "sheet": "Valuation", "target": "A30:M40"},
        {"style_id": "valuation_share_history_style", "sheet": "Valuation", "target": "A100:M109"},
        {"style_id": "valuation_gross_profit_helper_style", "sheet": "Valuation", "target": "A262:M262"}
      ],
      "activation_criteria": {"mode": "required_for_every_profile"},
      "empty_state_behavior": "The core model remains visible, but every unsupported value and derived output fails closed to blank.",
      "tests_required": ["period_axis_continuity", "exact_business_cell_ownership", "missing_input_formula_blank"]
    },
    {
      "module_id": "balance_cash_flow",
      "display_name": "Balance sheet and cash flow",
      "module_type": "core",
      "dependencies": ["core_financial_history"],
      "sheets": [
        {"sheet": "BS_Segments", "role": "visible_product", "legacy_class": "A", "default_state": "visible", "active_state": "visible", "inactive_state": "hidden", "capacity_rows": 110, "capacity_columns": 13, "headers": [], "empty_state": "Keep the financial frame visible and blank unsupported point-in-time fields.", "style_owner": "frozen_shell", "formula_owner": "standard_template_formula_contract"},
        {"sheet": "REPORT_BS_Q", "role": "hidden_support", "legacy_class": "B", "default_state": "hidden", "active_state": "hidden", "inactive_state": "hidden", "capacity_rows": 5000, "capacity_columns": 7, "headers": ["period", "metric", "value", "unit", "source_ref", "status", "definition"], "empty_state": "Header-only hidden projection until validated balance-sheet facts exist.", "style_owner": "frozen_shell", "formula_owner": "none"},
        {"sheet": "REPORT_CF_Q", "role": "hidden_support", "legacy_class": "B", "default_state": "hidden", "active_state": "hidden", "inactive_state": "hidden", "capacity_rows": 5000, "capacity_columns": 7, "headers": ["period", "metric", "value", "unit", "source_ref", "status", "definition"], "empty_state": "Header-only hidden projection until validated cash-flow facts exist.", "style_owner": "frozen_shell", "formula_owner": "none"}
      ],
      "visible_blocks": [
        {"block_id": "balance_history", "sheet": "BS_Segments", "target": "A1:M58", "empty_state": "Unsupported facts remain blank with explicit QA disposition."},
        {"block_id": "annual_financial_header", "sheet": "BS_Segments", "target": "A81:I89", "empty_state": "Visible periods are selected from complete annual candidates; missing evidence stays blank."},
        {"block_id": "annual_cash_flow_balance", "sheet": "BS_Segments", "target": "A92:I102", "empty_state": "Annual cash-flow and balance facts remain blank without complete evidence."},
        {"block_id": "valuation_cash_flow", "sheet": "Valuation", "target": "A41:M58", "empty_state": "Cash-flow history and formulas remain blank without complete evidence."},
        {"block_id": "valuation_capital_returns", "sheet": "Valuation", "target": "A60:M68", "empty_state": "Capital-return history remains blank without source evidence."},
        {"block_id": "valuation_per_share", "sheet": "Valuation", "target": "A112:M115", "empty_state": "Per-share outputs remain blank without compatible denominators."},
        {"block_id": "valuation_formula_helpers", "sheet": "Valuation", "target": "A263:M271", "empty_state": "Hidden formula inputs remain blank without validated facts."}
      ],